{
  "schema_version": "0.2.0",
  "channel": {
    "id": "https://w3id.org/battinfo/channel/a0w8-t55t-0e7t-r62d",
    "equipment_id": "https://w3id.org/battinfo/equipment/bw1k-j56y-r2ax-2adv",
    "index": 4,
    "short_id": "a0w8t5",
    "label": "MC3000-A/CH4",
    "status": "active"
  },
  "provenance": {
    "source_type": "lab",
    "retrieved_at": 1781900000,
    "battinfo_version": "0.7.0"
  },
  "notes": [
    "Slot 4 of the MC3000 unit. Deterministic uid from (equipment uid, index)."
  ]
}
